index,url,video title,category
dZe-5ZvODZ8,https://www.youtube.com/watch?v=dZe-5ZvODZ8,Feed for Thought: How to Successfully Wean Beef Calves,People & Blogs
ZBxlHyksDI8,https://www.youtube.com/watch?v=ZBxlHyksDI8,Filthy Farm Jobs | Philip Learns to Milk Cows | S1E2,People & Blogs
vt6EVhbuS_A,https://www.youtube.com/watch?v=vt6EVhbuS_A,Person Milking a cow,Entertainment
aTNg8lsUGXA,https://www.youtube.com/watch?v=aTNg8lsUGXA,Herding Cows Tips Secrets for Happy and Healthy Livestock,People & Blogs
98pd9mxeYqM,https://www.youtube.com/watch?v=98pd9mxeYqM,Secret To Making Millions In Pig Farming,Pets & Animals
22Tc7KW8oNM,https://www.youtube.com/watch?v=22Tc7KW8oNM,Raising Goats in Rancho Grande,Nonprofits & Activism
knpPY_rOw4A,https://www.youtube.com/watch?v=knpPY_rOw4A,How to milk a cow /Morden cow dairy farming /Cow milking by hand /Smart dairy farm in bangladesh,Pets & Animals
56dM7tLih1U,https://www.youtube.com/watch?v=56dM7tLih1U,3 Development of Rift Valley fever vaccine suitable for human and livestock use - George Warimwe,Science & Technology
QR8FLc5kIfk,https://www.youtube.com/watch?v=QR8FLc5kIfk,Cleaning after the cow's in the new barn whith Lely Discovery,People & Blogs
e7CmKcfrqzQ,https://www.youtube.com/watch?v=e7CmKcfrqzQ,Hand milking,Science & Technology
oNwjMD5C29A,https://www.youtube.com/watch?v=oNwjMD5C29A,What you need to know about Foot-and-Mouth Disease.,Entertainment
3zU6ON0wQtw,https://www.youtube.com/watch?v=3zU6ON0wQtw,Finishing Goat Milking Stanchion Made with Scrap Lumber (for FREE),Entertainment
MW2ELdljsgo,https://www.youtube.com/watch?v=MW2ELdljsgo,How To Train Your FAMILY MILK COW | Milking Cows 101,People & Blogs
tb4OiUS-vfY,https://www.youtube.com/watch?v=tb4OiUS-vfY,The Essential Guide to Goats in Farming Simulator 25,Gaming
x9rPLywWs_8,https://www.youtube.com/watch?v=x9rPLywWs_8,Setting Up the Winter Chicken Coop,Film & Animation
UPo2O_pZjpg,https://www.youtube.com/watch?v=UPo2O_pZjpg,TOP 10 SNOW REMOVAL MISTAKES TRACTOR OWNERS MAKE ❄️🚜👨‍🌾,Education
j86Eu4pPMqc,https://www.youtube.com/watch?v=j86Eu4pPMqc,7 Essentials TIPS for Raising Chicks,Howto & Style
DJ4iN6RTGDc,https://www.youtube.com/watch?v=DJ4iN6RTGDc,Cow milking by hand /Cow milking all animal health tips no1Cow milking by hand full video,Pets & Animals
jG_8wIY-VUw,https://www.youtube.com/watch?v=jG_8wIY-VUw,CONCRETE SIDING on a COOP | Chicken Coop PART - 7,Entertainment
A0ZQL3U60qw,https://www.youtube.com/watch?v=A0ZQL3U60qw,Bluetongue virus of ruminants,Science & Technology
spDJNIig6zY,https://www.youtube.com/watch?v=spDJNIig6zY,Feed and rations for backgrounding Nov 2020,Education
QFmZW4BkHGo,https://www.youtube.com/watch?v=QFmZW4BkHGo,Cleaning The Stable | Feeding Cows With Hay,Howto & Style
eKuf0fLpCos,https://www.youtube.com/watch?v=eKuf0fLpCos,Backgrounding feeds and rations Fall 2021,Education
4WxZUseQRRA,https://www.youtube.com/watch?v=4WxZUseQRRA,Backgrounding Cattle #1- Feeding calves in a declining market with Tim Petry.,Education
dp4ercv0Cq0,https://www.youtube.com/watch?v=dp4ercv0Cq0,SNOW PLOW VS SNOW PUSHER: WHICH ONE IS RIGHT FOR YOU? 👨‍🌾🚜❄,Education
dUUG_BgEhiw,https://www.youtube.com/watch?v=dUUG_BgEhiw,THE 'Why' behind Rotational Grazing,Science & Technology
774-NJlceJQ,https://www.youtube.com/watch?v=774-NJlceJQ,Manufacturing and Business Protocols for Goats Milk Soap Penny Adler SD,Education
B5heMtaWC9g,https://www.youtube.com/watch?v=B5heMtaWC9g,Mixing feed for 120 cows,People & Blogs
lH78XP8knMA,https://www.youtube.com/watch?v=lH78XP8knMA,Pig Farming for Beginners (MUST WATCH),Pets & Animals
vl30tK6SpTo,https://www.youtube.com/watch?v=vl30tK6SpTo,How to Take Care of My Cows Daily Routine for Top Care,People & Blogs
4YyiojlzF54,https://www.youtube.com/watch?v=4YyiojlzF54,Mob Grazing Sandy Smart SD,Education
PFj6Be9LKBY,https://www.youtube.com/watch?v=PFj6Be9LKBY,Checking in on the Chickens in their New Coop,Film & Animation
Kxw6kgNXgho,https://www.youtube.com/watch?v=Kxw6kgNXgho,WHAT RPM TO RUN YOUR TRACTOR? IT’S COMPLICATED,Education
nKIgff84n3Y,https://www.youtube.com/watch?v=nKIgff84n3Y,kohl FAQ bedding patterns in beef barns,Education
JwyjISk0G3o,https://www.youtube.com/watch?v=JwyjISk0G3o,IS THIS REALLY BETTER THAN A TILLER? A DISC THAT’S MADE IN THE USA!,Education
BjG5GveRr98,https://www.youtube.com/watch?v=BjG5GveRr98,Grazing Systems,Education
XjlrowuzAuY,https://www.youtube.com/watch?v=XjlrowuzAuY,Protecting livelihoods through livestock vaccination,Nonprofits & Activism
-MKt3Eq3-s0,https://www.youtube.com/watch?v=-MKt3Eq3-s0,The ONLY Dairy Farm I Will EVER Drink Milk From,Nonprofits & Activism
pg4vJ_fFw6M,https://www.youtube.com/watch?v=pg4vJ_fFw6M,What Size Of Pigs Should I Start My Farm With?,Pets & Animals
AWHS_aIzyHA,https://www.youtube.com/watch?v=AWHS_aIzyHA,Calving Later Makes all the Difference,Science & Technology
8gKlXtWRbQ8,https://www.youtube.com/watch?v=8gKlXtWRbQ8,Grazing Management – NDSU Extension Spring 2021 Horse Management Webinar Series,Education
b8QI5txu7ck,https://www.youtube.com/watch?v=b8QI5txu7ck,A Symphony of Agricultural Machines in the Fields – HuTaNaTu,People & Blogs
TP-sYhZMqCE,https://www.youtube.com/watch?v=TP-sYhZMqCE,Finally! We are going to have SO much MILK!,Pets & Animals
z2mCrBttkM4,https://www.youtube.com/watch?v=z2mCrBttkM4,Rotational Grazing,People & Blogs
k_G-2OTf-tY,https://www.youtube.com/watch?v=k_G-2OTf-tY,Working dog health Part 1 – General Health including worming and vaccinations,Science & Technology
xp5OMWZyZhk,https://www.youtube.com/watch?v=xp5OMWZyZhk,HOW to KEEP your CHICKENS WATER from FREEZING OFF-GRID HACK,Howto & Style
G-PVYT7a17U,https://www.youtube.com/watch?v=G-PVYT7a17U,Making and Testing Goat's Milk Cream Soap Penny Adler SD,Education
TaooW-zT4b8,https://www.youtube.com/watch?v=TaooW-zT4b8,Alternative Feeding For Cattle,Education
oe8DZEwyxvU,https://www.youtube.com/watch?v=oe8DZEwyxvU,Setting Up The Winter Chicken Coop Part 2 and Setting Up The Waterer,Film & Animation
v_u-8kJDkWQ,https://www.youtube.com/watch?v=v_u-8kJDkWQ,Eradicating Peste des Petits Ruminants Globally,Nonprofits & Activism
0e0cjhRC-RU,https://www.youtube.com/watch?v=0e0cjhRC-RU,Dam Raised Baby Goats are they friendly? My experience after 1 month,Pets & Animals
ekx2XcYxVxQ,https://www.youtube.com/watch?v=ekx2XcYxVxQ,Manure and nutrient production bedding design tips for beef barns,Education
ktCrc0URpCI,https://www.youtube.com/watch?v=ktCrc0URpCI,Four(4) Tips For Making More Money In Pig Farming,Pets & Animals
6vhFpQTMGu4,https://www.youtube.com/watch?v=6vhFpQTMGu4,HOW TO USE A BOX BLADE TO REMOVE DIRT #tractors #homesteading #kubota,Education
DjkAt8qciV0,https://www.youtube.com/watch?v=DjkAt8qciV0,Beef producers prioritizing cow-comfort (video),Education
zfNbC9p5zEI,https://www.youtube.com/watch?v=zfNbC9p5zEI,Day in the Life of an IL Dairy Farmer #shorts,People & Blogs
xrOdem1ENvM,https://www.youtube.com/watch?v=xrOdem1ENvM,Best Pig Breeds For Commercial Pig Farming,Pets & Animals
fomDWeV8i2Q,https://www.youtube.com/watch?v=fomDWeV8i2Q,Milking Cows with Hand,Nonprofits & Activism
Qwcmw3DV_Mc,https://www.youtube.com/watch?v=Qwcmw3DV_Mc,WHO IS THE GOAT MILKING CHAMPION?,People & Blogs
0T61OtYydXc,https://www.youtube.com/watch?v=0T61OtYydXc,How to Milk a Cow By Hands | Evening Milking Of Cow By Hand,News & Politics
Q3GI9M0I4us,https://www.youtube.com/watch?v=Q3GI9M0I4us,EXPLAINING HYDRAULIC MULTIPLIERS 3RD FUNCTIONS & DIVERTERS,Education
cYwyBM6CFVM,https://www.youtube.com/watch?v=cYwyBM6CFVM,B+LNZ Farming for Profit: Regenerative Agriculture in Your Farm System – Alister Moorhead,Science & Technology
BvS_m8xKunI,https://www.youtube.com/watch?v=BvS_m8xKunI,Unfiltered: 24 Hours On A 4th Generation Dairy Farm,Travel & Events
sAlyB5E5kOU,https://www.youtube.com/watch?v=sAlyB5E5kOU,10: Hygiene in the shed? Let the cows tell you! Scoring system,Education
VPBovuhCdsc,https://www.youtube.com/watch?v=VPBovuhCdsc,Digital agriculture good practice - Automated dairy farm management saves time and keep cows healthy,Nonprofits & Activism
8lrdEJAsBlw,https://www.youtube.com/watch?v=8lrdEJAsBlw,The Most Satisfying Highland Cow Cleanup Ever,People & Blogs
outbfQcvRyA,https://www.youtube.com/watch?v=outbfQcvRyA,Yemen: Protecting sheep and goats against disease,Nonprofits & Activism
7LMbMld45KY,https://www.youtube.com/watch?v=7LMbMld45KY,SHOULD YOU USE YOUR BUCKET FOR SNOW REMOVAL? ❄️🚜❄️,Education
w-vw66CZNAo,https://www.youtube.com/watch?v=w-vw66CZNAo,Morning Chores In The Farm | Feeding Livestocks | Building The Pig Pen From Start To Finish,People & Blogs
JBZYowX_x0k,https://www.youtube.com/watch?v=JBZYowX_x0k,Goat Vaccination Day! Protecting My Herd Against Tetanus & Clostridial Diseases,Education
P0hjMfoUpcY,https://www.youtube.com/watch?v=P0hjMfoUpcY,Changing the Dairy Industry by Perfect Day,Science & Technology
Yb0E4WpZ_q8,https://www.youtube.com/watch?v=Yb0E4WpZ_q8,WJ Sexten Farmers Forum Grazing Presentation 2012,Education
r-p7DeOPtgU,https://www.youtube.com/watch?v=r-p7DeOPtgU,Basic Requirements To Start Your Own Pig Farm,Pets & Animals
0wflNdDDbSc,https://www.youtube.com/watch?v=0wflNdDDbSc,COMPARING 3 POINT QUICK HITCHES! 2020 VERSION 😎👨‍🌾🚜👩‍🌾,Education
xnUZKWLh5XM,https://www.youtube.com/watch?v=xnUZKWLh5XM,PLOWING A FIELD WITH A SMALL TRACTOR. DID IT WORK? 🤔🚜,Education
pA5w8cMvL3Q,https://www.youtube.com/watch?v=pA5w8cMvL3Q,Finishing Cattle in Hoop Barns,Education
IDmqBTKNNZw,https://www.youtube.com/watch?v=IDmqBTKNNZw,FAO Animal Health Vaccination Campaign Against PPR in Syria,Nonprofits & Activism
bnjiYnza5NQ,https://www.youtube.com/watch?v=bnjiYnza5NQ,3-Point Middle Buster,Autos & Vehicles
jckM1lCKFnE,https://www.youtube.com/watch?v=jckM1lCKFnE,how to milk a cow by hand #trending #youtubeshorts #viral #viralshort #,People & Blogs
nsR0PEPiLEc,https://www.youtube.com/watch?v=nsR0PEPiLEc,smart dairy farm / how to milk a cow /cow milking by hand /buffolo milking all animal health tis no1,Pets & Animals
gsIG4pMd-dM,https://www.youtube.com/watch?v=gsIG4pMd-dM,Goat Milk Recipe- Replacer Milk | How to feed your Baby Goat/What I use | Mom of 10,People & Blogs
IklwQUD2vQo,https://www.youtube.com/watch?v=IklwQUD2vQo,Fastest First Freshener Goat Birth EVER Filmed!,Education
QxUFWzfEqR4,https://www.youtube.com/watch?v=QxUFWzfEqR4,Revolutionize Your Chicken Coop with the Ultimate Deep Litter System | Order Now! #poultryfarming,Science & Technology
Sj7OVPhQewI,https://www.youtube.com/watch?v=Sj7OVPhQewI,THIS IS WHY YOU WANT A SNOW PUSHER. #tractors #snowremoval #madeincanada,Education
7IFPsttWry4,https://www.youtube.com/watch?v=7IFPsttWry4,LEARN THIS INCREDIBLY SIMPLE FIX FOR YOUR QUICK HITCH. 🚜 🧑‍🌾 👩‍🌾,Education
lSr2afXh6xE,https://www.youtube.com/watch?v=lSr2afXh6xE,Benefits of Extending the Grazing Season,Science & Technology
B2LFVh1m5dQ,https://www.youtube.com/watch?v=B2LFVh1m5dQ,SHOULD YOU USE A PLOW OR A ROTOTILLER? WE COMPARE THE TWO.,Education
c31gnELd2DU,https://www.youtube.com/watch?v=c31gnELd2DU,Shit that Goes Down on the Dairy Farm,People & Blogs
g3ccIAdm-e0,https://www.youtube.com/watch?v=g3ccIAdm-e0,Heat Lamp and Heat Plate Differences | Cackle Hatchery,Pets & Animals
NuNeKHbWuw8,https://www.youtube.com/watch?v=NuNeKHbWuw8,Continuous Grazing VS Rotational Grazing,People & Blogs
Uft6NP7rgLs,https://www.youtube.com/watch?v=Uft6NP7rgLs,Cattle Feeding Scenarios 2021,Education
FZIeRyTq6T8,https://www.youtube.com/watch?v=FZIeRyTq6T8,Pig Pen Improving Conditions for the Feeder Pigs,Howto & Style
FHZl8M16MLk,https://www.youtube.com/watch?v=FHZl8M16MLk,How do vaccines work?,Science & Technology
yKmEkvnlbBs,https://www.youtube.com/watch?v=yKmEkvnlbBs,Backgrounding Budgets and Profits for Cattle Nov 2020,Education
ygblfqUNvC0,https://www.youtube.com/watch?v=ygblfqUNvC0,Sustainable Dairy Cropping Systems: The Virtual Dairy Herd,Education
Cxw5brN3J7s,https://www.youtube.com/watch?v=Cxw5brN3J7s,WHAT QUICK HITCH DO YOU NEED? CAT 1 VS CAT 2 QUICK HITCHES 🚜,Education
9WodVxIxsWE,https://www.youtube.com/watch?v=9WodVxIxsWE,From farm to table: Hog processing in action @UncleTimsFarm,Howto & Style
v899OGwjgkE,https://www.youtube.com/watch?v=v899OGwjgkE,Prepping the Chicken Coop for Winter ~ FAIL,Howto & Style
1ATibe4aTSU,https://www.youtube.com/watch?v=1ATibe4aTSU,How To Introduce A New Hen To The Hen House,People & Blogs
bvLLu4PlUng,https://www.youtube.com/watch?v=bvLLu4PlUng,Morning Routine on Zen Dairy Goats Farm,People & Blogs
VZsHFormuGg,https://www.youtube.com/watch?v=VZsHFormuGg,He Left the UK to Become a PIG FARMER in Nigeria?,Travel & Events
eOulwXmYUzc,https://www.youtube.com/watch?v=eOulwXmYUzc,Rancher Shares Secret to Transforming Land FAST,Science & Technology
VHA_E3YTfDk,https://www.youtube.com/watch?v=VHA_E3YTfDk,Milking a cow at Lake Metroparks Farmpark.,People & Blogs
